{
  "schema_version": "1.0.0",
  "hardware_profile_id": "opendroneid-external-decoded-v3.7.0",
  "status": "DECLARED",
  "receiver": {
    "manufacturer": "EXTERNAL_RECEIVER_BOUNDARY",
    "model": "OPERATOR_SELECTED",
    "driver_or_firmware": "OpenDroneID receiver release v3.7.0 decoded NDJSON bridge",
    "revision": "v3.7.0@60b4320"
  },
  "capabilities": [
    {
      "protocol": "REMOTE_ID",
      "bands": ["UPSTREAM_DECLARED_PER_MESSAGE"],
      "measurement_types": ["DECODED_BROADCAST_REMOTE_ID"],
      "verified": false
    }
  ],
  "verification": {
    "verified_at_utc": null,
    "method": "Host NDJSON contract and synthetic end-to-end loop verified; exact radio, driver, decoder bridge, and transport require a receive-only over-air audit.",
    "evidence_refs": [
      "docs/REMOTE_ID_SOURCE_LOCK.md",
      "TESTS/test_live_remote_id.py",
      "TESTS/synthetic_traces/remote_id_mobile.ndjson"
    ]
  },
  "limitations": [
    "DECLARED is not BENCH_VERIFIED or FIELD_VERIFIED.",
    "Transport coverage is limited to what the external receiver and driver actually report.",
    "Stream continuity cannot establish absence of Remote ID.",
    "Decoded Remote ID is not authenticated identity or evidence of surveillance capability."
  ]
}
